{
  "firstname": "",
  "lastname": "",
  "handle": "Reverend Rat",
  "birth": "",
  "death": "",
  "obituary": "",
  "issue": "184",
  "affiliations": "",
  "mainimage": "/images/face-silhouette-clipart.png",
  "maintext": "<p>Reverend Rat was a member of the hacker and information security community.</p>",
  "socialmedialinks": [
    {
      "sitename": "Twitter Memorial",
      "siteurl": "https://twitter.com/marcwrogers/status/1438186471907737600"
    }
  ],
  "references": [],
  "contributions": [],
  "gallery": []
}
