{
  "firstname": "Karl",
  "lastname": "Koch",
  "handle": "",
  "birth": "1965",
  "death": "1989",
  "obituary": "",
  "issue": "23",
  "affiliations": "",
  "mainimage": "/images/face-silhouette-clipart.png",
  "maintext": "",
  "socialmedialinks": [
    {
      "sitename": "Wikipedia",
      "siteurl": "https://en.wikipedia.org/wiki/Karl_Koch_(hacker)"
    }
  ],
  "references": [],
  "contributions": [],
  "gallery": []
}
