{
  "firstname": "Obsèques",
  "lastname": "de Paolo",
  "handle": "",
  "birth": "",
  "death": "",
  "obituary": "",
  "issue": "20",
  "affiliations": "",
  "mainimage": "/images/face-silhouette-clipart.png",
  "maintext": "",
  "socialmedialinks": [],
  "references": [],
  "contributions": [],
  "gallery": []
}
