{
  "firstname": "Chris",
  "lastname": "",
  "handle": "The Nightstalker",
  "birth": "",
  "death": "",
  "obituary": "https://web.archive.org/web/20181021094502/http://w3.cultdeadcow.com/cms/nightstalker.html",
  "issue": "201",
  "affiliations": "Cult of the Dead Cow",
  "mainimage": "/images/face-silhouette-clipart.png",
  "maintext": "<p>Chris, known as The Nightstalker, was a member of Cult of the Dead Cow (cDc), one of the oldest and most influential hacking groups in the United States.</p>",
  "socialmedialinks": [],
  "references": [],
  "contributions": [],
  "gallery": []
}
