{
  "firstname": "Donald",
  "lastname": "Skelton",
  "handle": "",
  "birth": "1989",
  "death": "2023",
  "obituary": "",
  "issue": "191",
  "affiliations": "303",
  "mainimage": "/images/DonaldSkelton.webp",
  "maintext": "<p>Donald Duane Skelton was a member of the 303 hacking group. He passed away on January 18, 2023, after a prolonged battle with illness. He is survived by his wife and two sons.</p>",
  "socialmedialinks": [
    {
      "sitename": "GoFundMe",
      "siteurl": "https://www.gofundme.com/f/donald-dwayne-skelton"
    }
  ],
  "references": [],
  "contributions": [],
  "gallery": []
}
