{
  "firstname": "Nick",
  "lastname": "Jeremicah",
  "handle": "Dr. Nick2000",
  "birth": "1977",
  "death": "2006",
  "obituary": "",
  "issue": "35",
  "affiliations": "Goon",
  "mainimage": "https://www.defcon.org/images/links/whois/drnick.jpg",
  "maintext": "<p>Dr Nick aka Nick Jeremicah lost the battle against cancer in the fall of 2006.<br /><br />He is survived by his parents, siblings, wife and two children.<br /><br />Dr Nick2000 was 30 years old.</p>",
  "socialmedialinks": [],
  "references": [],
  "contributions": [],
  "gallery": []
}
