{
  "firstname": "Joe",
  "lastname": "Engressia",
  "handle": "Joybubbles",
  "birth": "",
  "death": "",
  "obituary": "",
  "issue": "16",
  "affiliations": "",
  "mainimage": "/images/face-silhouette-clipart.png",
  "maintext": "",
  "socialmedialinks": [],
  "references": [],
  "contributions": [],
  "gallery": []
}
