{
  "firstname": "Bill",
  "lastname": "",
  "handle": "Wolfgame",
  "birth": "",
  "death": "2019",
  "obituary": "",
  "issue": "59",
  "affiliations": "",
  "mainimage": "/images/Bill.jpg",
  "maintext": "25 years later, still Wolfgame.  IT Consultant, Cider Enthusiast, Vaper, Gamer, and cranky fucker with no time for your shit.",
  "socialmedialinks": [
    {
      "sitename": "Twitter",
      "siteurl": "https://www.twitter.com/wolfgame"
    }
  ],
  "references": [],
  "contributions": [],
  "gallery": [
    {
      "url": "/images/Bill.jpg",
      "title": "Bill (Wolfgame) at a 2600 NYC dinner in 1996",
      "caption": "Bill (@wolfgame) in the middle wearing a birthday crown at a 2600 NYC dinner for Meme's birthday in 1996. Photo by Pamela Howell (@serendipitousP)."
    }
  ]
}
