{
  "firstname": "Aaron",
  "lastname": "Testerman",
  "handle": "",
  "birth": "March 17, 1978",
  "death": "May 11, 2020",
  "obituary": "https://www.dignitymemorial.com/obituaries/colton-ca/aaron-testerman-9181596",
  "issue": "135",
  "affiliations": "",
  "mainimage": "/images/face-silhouette-clipart.png",
  "maintext": "<p>Aaron Testerman was a member of the information security community. He was born on March 17, 1978 and passed away on May 11, 2020 in Colton, California at the age of 42.</p>",
  "socialmedialinks": [],
  "references": [],
  "contributions": [],
  "gallery": []
}
