{
  "firstname": "Fabian",
  "lastname": "Rodriguez",
  "handle": "scrotum man",
  "birth": "",
  "death": "2022",
  "obituary": "",
  "issue": "185",
  "affiliations": "",
  "mainimage": "/images/face-silhouette-clipart.png",
  "maintext": "<p>Fabian Rodriguez, known as scrotum man, was a member of the hacker community.</p>",
  "socialmedialinks": [],
  "references": [],
  "contributions": [],
  "gallery": []
}
